Persona,CurrentHealth,MaxHealth,MovementSpeed,DashSpeed,AttackDamage,AttackCooldown,DashDamage,DashCooldown,DashDistance,Keys,Coins,Color,Description,Email,Username
Normal,3,3,5,10,1,0.5,5,5,0.5,0,0,White,Just be yourself,,
Warrior,3,3,5,10,2,0.5,3,3,0.5,0,0,Yellow,Looks like a well rounded character. A great choice!,,
Speedster,2,2,7,10,4,0.5,5,7,0.5,0,0,Blue,"Speedy, strong and squishy! A true glass cannon.",,
Charmer,3,3,5,10,2,0.5,5,5,0.5,0,0,Pink,Well rounded. This character was a true charisma build.,,
Tank,6,6,4,10,1,0.5,5,5,0.5,0,0,Orange,Talk about Tanky! Hope you don't plan on getting anywhere fast though.,,
Assassin,4,4,5,10,1,0.5,7,5,0.5,0,0,Black,Weak attacks but excellent dashes. This was a real min/maxer!,,
Ranger,2,2,6,10,0.75,0.35,4,8,0.5,0,0,Green,Everyone likes a Ranger,,
